,content
198,"Hanne Quillevere - a quiet member here - has published The Pivotal I Ching for Kindle. (Note: you can buy and read Kindle books on your computer - no need to own a Kindle.) Here you go:http://www.amazon.com/dp/B00AY1ODNU/ref=rdr_kindle_ext_tmbIt's a full commentary, no translation; 'pivotal' because she treats each line as a pivot between hexagrams, with explicit mention of zhi gua and fan yao for each. The free sample includes hexagrams 1 and 2.(I can't get further at the moment because Amazon's sending me in circles between .com and .co.uk and not letting me purchase. Probably you will have better luck...)"
199,The Myths of Yü the Great and the Wheel of Rangarhverfi - how intriguing does that sound? And it's in Chinese.Any readers of Chinese want to have a look?
200,"Hi all-As some of you know I collected most everything I could find for my research,around 200 volumes, the majority now out of print and some quite rare.I want to let go of my 100 least favorite volumes, so this offer is really for collectors.This is most of the C List in my bibliography and half of my B List.See that here: http://www.hermetica.info/E-YiBib.htm 100 volumes for US$ 600, postage paid within the US. Overseas is a different puzzle."
201,"Hi All,I just wanted to share an interesting link to Ricardo Andreé's YouTube channel. He recently uploaded more than thirty short videos (their average time is about 17 minutes each) where he explains his methods. They are in Spanish but a few people here can follow them.https://www.youtube.com/user/ichingandreeCheers,"
202,"Hi all, I promised you a new Wen Wang Gua book review a while ago. Here it is  I wish to introduce you The Clear-Cut I Ching For Beginners by Master S.R.Chang. http://www.cciching.com/At Amazon.comIt is actually another Wen Wang Gua book and I discovered it while I was looking exactly for this, for books about Wen Wang Gua. First I was a little bit disappointed, because I expected, or better said hoped that it would be another book which is teaching Wen Wang Gua. This is not the case here. But then I started to read it and to work with it and recognized that I discovered another treasure although it doesn`t teach Wen Wang Gua. It is a prepared text of the 64 Hexagrams and so it works similar to the use of the Text I Ching as we all know it, but the text is different. The advice you get is short and clear and there is no interpretation needed, because the answers are more than easy to understand. Not only the text is different, the casting methods are also different and I find this very intresting. Master S.R. Chang offers 4 methods of Casting: 1. The Coin Toss Method:This is similar to the casting method of the text I Ching. You throw your coins six times and write down the lines of the Hexagram (according the instructions by Master S.R.Chang) but there are no changing lines. The Hexagram is always unchanged. 2. The Playing Card Method:I left this one for you to try by yourself  3. The Tarot Card Method:Well this one is just great. You choose six Tarot Cards instead of tossing the three coins and so you get a lot of additional information about the situation, by the Tarot Cards. This is the most complex casting method Master S. R.Chang offers, because here you get the most information. I like it a lot, but I just use it if I actually need more detailed information. Apart from that I like the Coin Toss Method most. 4. The Numbers Remainder Method:This is intresting and it works. For this casting method you need nothing else than yourself. No coins, no cards just your mind. You concentrate on your question, and when you are ready then you release the question and when your mind is temporarily blank, allow a two-digit number to emerge from your mind. According a certain method explained at the book you find out your oracle then. I also tried this and felt a bit strange by doing this, but it seems to work as well as all the other casting methods. If you have casted your Hexagram you can look it up at the book and get your oracle. It works similar to the use of the normal text I Ching. There are the 64.Hexagrams, but the text is different to the I Ching how we all know it. Master S.R.Chang wrote an introduction for each hexagram and its general meaning and then some categories are following for the outcome in general, job and career issues, legal matters, health issues, projects, conflicts, love and relationsship questions and so on. Please check out Master S.R. Chang`s blog because there are all examples of the content. The answer is to get quick and easy, it is short and clear. The Clear Cut I Ching. This is for all the beginners in I Ching at all. All of you who have got problems to understand and interprete the regulary text of the I Ching will find very easy, a clear and simple answer here. For all of you who are consider about the main meaning of the pure unchanged Hexagram this is a great lesson too because exactly this is the message here. There is no compromise, no doubt, no changing lines or complicated analysis, no puzzles at this Clear Cut I Ching. You ask and you get a clear answer and you don`t need to ask Yi a hundred times in addition for to understand the meaning because each child would understand the answer immediately and easily. For advanced ones this is also great because it is just a great relief to get this pretty clear oracles no matter if they are auspicious or inauspicious. It`s just great to get this clear answer at all. The Clear Cut I Ching found its permanent place among all my other I Ching books and I consult it as often as I do this with other methods, because I also like the effectivity of  simplicity a lot. The Text of the Clear Cut I Ching and what it has to do with Wen Wang Gua is explained at the book:Master S.R.Chang literally: „The Chinese characters above are a partial representation of the symbols used in the full Clear Cut- method of the I Ching analysis. For the readers of this book, you should not be concerned with those symbols and characters at all. I have included them here out of my deepest respect for the Clear-Cut Method and its long-lineage of practitioners. Indeed the Clear-Cut Method is vastly deeper and richer than the version presented here. Neverthless, the ancient and the closely guarded book of Duan-Yi-Tian-Ji 斷易天機 or DYTJ inspired this first-ever English version of the Clear-Cut Method. The book DYTJ is believed to have been written in the Wan-Li Period of the Ming Dynasty, between 1573 CE to 1620 CE, or about some 400 years ago. Although the aforementioned book was written 400 years ago; but it was a continual expansion on a divination system that traces its origins to over 2,000 years ago. What makes this particular book, DYTJ, extraordinary was that in addition to the deep and complex discourses on the traditional Clear-Cut Method of the I Ching, the author wrote direct and clear answers to between sixteen to nineteen question categories of everyday life situations for each of the sixty-four hexagrams. Therefore, even the readers of the original DYTJ book were able to get clear and direct answers to their questions without having to go through the rigorous training process of the entire Clear-Cut Method. Since the book was written more than 400 years ago, many of the original questions categories and the answers given no longer fit the modern world. Inspired by the original intent of the book, I have thus re-calculated, expanded, modified, and updated the materials to fit the modern world. „ Quote end. One special highlight for me was the introduction of the book „The origins of the Clear-Cut Method“, because Master S.R.Chang told us the whole story of Jing Fang`s live and destiny and he also talked about the Master of Jing Fang which is called Jiao Yan Shou and that was really first time I have read the whole story. Many thanks for this to Master S.R. Chang  You can also read this on his blog:http://www.cciching.com/the-clear-cut-method/This Clear Cut I Ching is a completely new kind of I Ching book and it could also be called Wen Wang Gua light version, because you don`t need to learn Wen Wang Gua for to use this Clear Cut I Ching for beginners. Everybody can use it and understand it easily. It is great for beginners and advanced and it is just the beginning. I`m full of expectations concerning the next books by Master S.R. Chang and hope to help you with my new discovery the Clear-Cut I Ching. Just try it and you will also discover the effectivity of simplicity and you also will find the clear answers you had been looking for. For all Wen Wang Gua practitioners: The adoption of the 12 Earthly Branches, The Wu-Xing properties, The 5 Relatives, Subject and Object Line is already done at all the 64. Hexagrams. So this book can also be used as a reference book for the setting at all hexagrams. Master S.R.Chang used the chinese Characters here only, but all Wen Wang Gua practitioners should anyway learn the chinese Characters too for to understand additional literature about the theme much better and because in respect for the traditions. I will give you here the translation for all Chinese Characters Master S.R.Chang used at the Hexagrams. (read it from left to right)First Column:The 5 Relatives, respectively 6 Relatives/ Liu-Qin 六親.Parent/Fu-Mu 父母Sibling/Xiong-Di 兄弟Child/ Zi-Sun 子孫Asset/ Qi-Cai 妻財Officer/ Guan-Gui 官鬼Second Column:Numbers which determine the Hexagram.Third Column:10 Heavenly Stems/ Shi Tian-Gan 十天干 Jiǎ /甲  Wood Yang +  Yǐ  /乙 Wood Yin - Bǐng/丙 Fire Yang + Dīng /丁Fire Yin - Wù /戊 Earth Yang + Jǐ /己 Earth Yin -Gēng /庚Metal Yang +Xīn/辛Metal Yin -Rén /壬Water Yang + Guǐ /癸Water Yin -Fourth Column:12 Earthly Branches/ Shi er Dìzhī/ 十二地支Zǐ/ 子 = Strong WaterChǒu/ 丑= Cold Wet SoilYín/ 寅 = GrassMǎo/ 卯 = Big TreeChén/ 辰 = Soft Warm SoilSì/ 巳 = Small FlameWǔ/ 午 = Strong FireWèi/ 未 = Warm Dry SoilShēn/ 申 = Weak MetalYǒu/ 酉 =  Strong MetalXū/ 戌 = Hard Cold SoilHài/ 亥 = Water VaporFifth Column: 5 Elements/ Wu-Xing 五行 Metal/Jin 金Wood/Mu 木Water/Shui 水Fire/Huo 火Earth/Tu 土Sixth Column: Self Line/ Shi-Yao 世爻Object Line/ Ying-Yao 應爻Best wishes YvonnePs: By the way: Clear-Cut I Ching/Duan-Yi 斷易  is another search word, because this is also one of the many names for Wen Wang Gua Last edited: May 12, 2013"
203,- here's one on Hexagram 31: http://wiching.wordpress.com/2013/05/06/yi-jing-iching-esagramma-31/Google Translate does a good enough job to make this perfectly readable - and it's good.
204,"I hope this  shameless plug is acceptable for posting.After years of prototyping and modifications, the first generation of Yi Dao circlets are now available for sale at my Etsy store:http://www.etsy.com/shop/AmaranthBeadsThe Yi Dao circlet is a set of meditation beads inspired by the mala of Buddhist and Hindu cultures and the prayer beads and worry beads of other cultures. It has a 'tower' representing Tai Qi, Si Xiang and Ba Gua, and 64 beads, one for each hexagram. The document that accompanies the beads and discusses Yi Dao (the Path of the Yi Jing, or Easy Path), and the use of the beads in meditation is too large to attach here, so please email me directly if you would like a copy.Please note, there are several kinds of circlets available. All of the ones currently on sale have identical or matching stones at the end of each row. I am placing some of the new circlets in the store soon. This new design of circlet has seven different stones at the row ends (with the eight row end a normal sized stone). I can also create custom circlets using your own beads as long as they are within a certain range of sizes and of a material that stands up under use.Regards,Chris Gait"
205,"Hi,I have a question about the hexagram lookup table that appears in the Richard Wilhelm translation of the I Ching. The Wikipedia (http://en.wikipedia.org/wiki/I_Ching) hexagram lookup table uses the same sequence as Wilhelm, but the Wilhelm translation makes no mention of why the arrangement was chosen. The upper and lower trigrams do not follow either the Fu Xi (Qian, Xun, Kan, Gen, Kun, Zhen, Li, Dui) or King Wen (Li, Kun, Dui, Qian, Kan, Gen, Zhen, Xun) trigram sequences, and instead are Qian, Zhen, Kan, Gen, Kun, Xun, Li, Dui, which is similar to Fu Xi except that Xun and Zhen are switched. Does anyone know why this sequence of trigrams was chosen for the lookup table, and whether it is unique to the Richard Wilhelm translation? Is it useful?Thanks,Brian"
206,"Is anyone familiar with RGH Siu's The Portable Dragon? I get the sense that hes' trying to get across the general description and feeling of each hexagram, but as far as I can tell (maybe I'm overlooking something very obvious) he's not discussing the lines at all."
207,"More on that ‘Radical Change at the Well’ reading soon, I promise. But first… Please will you do me a big favour and take this survey? Some background… I store a list of my readings on the computer. It’s tremendously helpful – it means that when I think, ‘Oh, hexagram 19, didn’t I get that a couple of months ago…?’ or even, ‘Wait, haven’t I already asked something like this?’ I can run a quick search and find the answer. It makes it that much easier for me to get the message and keep it in mind – carry it with me so that it makes a difference. Which, after all, is the point. Only then there are dreams, and sometimes I might pick a rune out of a bag or pick a book off the shelf at random, and what about the weirdly synchronistic thing I heard when I turned on the radio last night, and the meetings of goldfinches outside my window? I do my best to write these down, too, and keep track, and not lose sight of the overall themes and messages. But wouldn’t it be brilliant to have one place for it all – not just to write it down, but to find half-remembered things and see at a glance the unifying themes that I’d somehow missed? Well… I thought so… and to my complete delight, Justin Farrell (author of a excellent Yijing journal program) is prepared to create the software to do it: a journal software where you store all these things, and can review them via search or tag cloud. He just needs to know whether anyone else would buy it. So actually I have two requests. First, please take the survey! And second, do you know people who are not so Yijing-oriented, who wouldn’t be reading this blog, but who might be interested in software for some combination of dreams, synchronicities, tarot, runes and astrology? If so, could you forward them the link? Here it is to copy and paste – http://www.onlineclarity.co.uk/journalsurvey.phpThank you! (By the way… there is a prize draw as a ‘thank you’ for doing the survey – nothing huge, but a free copy of the finished software, and a £20 Amazon gift voucher.)"
208,"I’ve been very quiet lately – busy preparing to upgrade all the software that runs Clarity. Now it’s time to take the plunge and run the upgrades. While the upgrades are running, some things – the forum, shop and anything you log in to – won’t work. They’ll close on Monday morning, and if all goes well they should be back within the week. For more information, and an email list that’ll provide more detailed updates, see this page. Thanks in advance for your patience!"
209,A pdf you can download here:http://www.yjcn.nl/wp/the-yijing-as-oracle-bones-sidekick-a-study-of-heng-亨/(I've only just started reading - I just assume it's going to be eye-opening.)
210,"This is a wonderful informative website -Gnostic i ching is a section devoted to i ching.Astounding information, astonishing amount of information on each hexigram and moving lines.There you go ."
211,"I received this email from Betina Wilhelm today.""The DVD of ""Wisdom of Changes"" finally has a release-date in the US, March 19th.It can be purchased f.e. via Amazon.com.""- LL"
212,"Is this I Ching news? I happened to Google 'plastromancy' and came acrosshttp://plastromancy.com/It says:Plastromancy.com’s iChing + Lambdoma Music Therapy Software January 13th, 2013    Plastromancy.com is a music therapy desktop application for Mac OS X (Intel).What is i-ching lambdoma? I-Ching Lambdoma is a culmination of over 10 years of research into  sound-induced experiential expansion, resulting in the past, present and  future richness of the human experience. With the advent of modern computational aural technology, we as  people have been able to discover experiential learning at our  fingertips. What many of us need is a way to initiate a conversation with our inner vision. Plastromancy.com’s iChing Lambdoma is that layer in which we can  experience thought, meaning, spirituality, duality, dimensionality  inside and out, in a synesthetic way.Click to expand..."
213,This new book is available at Amazon.com and other sites.A sample of the book can be downloaded at:http://yijingdao.orgThere is a Spanish version available as well: YiJing (I Ching) Diccionario de caracteres chinos con concordancia y traducción.
214,http://www.biroco.com/yijing/wilhelm.htmSergio
215,"Tomorrow is the Mayan beginning of the 5126 year cycle, the 14th B'ak'tun, unless the alternative counting method gives us Sunday instead. This change is probably more significant than is reckoned by the skeptics, but in any event it is the first day of the winter of 2013. For those of you who follow the 6 phase annual gua method that I have articulated elsewhere, this is the first day of the new gua that will unfold throughout 2013.If you have determined the gua, tomorrow the first line will become active and remain active until February 18th of 2013, when fate will transition to the second line. This is a reminder to contemplate that first line, absorb its iconography, take to heart its advice, and prepare. Let the image guide your behavior, the judgment guide your prognostication, and the line drive your insights and actions.Regardless of what the significance of the Mayan rollover of the long count, the I Ching will function, because it is part of nature, human nature, and human civilization. Even if one accepts the idea of cataclysm, one's role in it would be clearly defined by the I. If the cataclysm does not materialize, it changes nothing as far as using the book to apprehend, accept, and follow the Tao."
216,"For readers of Russian (Peter, you there?), there is a new book out which is said to 'prove that hexagrams’ order existing in The Book of Change is a solely correct  one and that it is obeys the Luo-shu “magic” square mathematical law.' Its authors, Gennadij Fomyuk and Elena Kudina, emailed me from Kiev with this description and promise of an English version, and also said you could download the Russian version from their sites, http://gennadij-fomyuk.narod.ru/index.html and http://arbuz.uz/s_kniga.html  ."
217,"Scott Davis, a good friend that hosted my son for a few days in Miyazaki Japan last year, has a new book on the Yijing to be released in the next few days.Congratulations Scott!"
218,"Every now and then I visit Amazon, search for 'I Ching' and 'books', and sort by publication date. My last search brings up quite a crop that are just out, or due out over the next few weeks and months. Some of the titles sound promising; few have any description. Any thoughts/ comments/ expectations for any of these? - The I Ching Workbook, Roger Green- The I Ching: The Book of Chance and Change, Tom Leworthy - Fathoming the Cosmos and Ordering the World: The Yijing (I-Ching, or Classic of Changes) and Its Evolution in China (Richard Lectures), Richard J. Smith (note to self: buy it)- The I Ching: Points of Balance and Cycles of Change,Peggy Jones- Simply I Ching, Kim Farnell- The Women's I Ching,Sarah Denning - Whole Heart of I Ching: The Complete Teachings from the Chinese Book of Changes, John Bright-Fey- Tao I Ching: The Mystic Gateway, Tom W.A. Leworthy"
219,"Hi all,I've just opened a new board about the Yijing, entirely in italian language.It's called ""Noi e il Mutamento"" and you can find it at www.noieilmutamento.net.It includes many different forums, for: sharing readings, sharing experiences, in-depth yijing study, relations between yijing and any field of human knowledge and life, news from the world and more.All italian speaking people are welcome!"
220,"Here - have a look at this:http://www.ichinglivingchange.org/A link for consultations, and bucketloads of papers and articles available for free. Time to create a 'Karcher' folder on the hard drive..."
221,"For those who read my post on Another Method, describing the use of the I Ching by divining a year for a hexagram and attributing one line for each two astro signs, starting at the winter solstice ( yes, it is highly specific) - We are now in the 5th line of the year.  It began on August 21 and will end on October 21st. Example - year of peace - 11. Peace is about the mixture of the high and the low. Such mixture is advantageous.  During this fifth line, phase, I needed to move some furniture.  I was introduced to a sterling elder Mexican American gentleman who loaned me out of the goodness of his heart his truck at no cost.  What a great old 1989 Silverado truck with over 200,000 miles on it.This simple man loaned me his truck while he was at church on two Sundays, where he was a leader in his community. The second Sunday his brakes failed and he and I rebuilt the left rear brake assembly, which was it tuns out of great help to him.  All went well - the mixture of high and low, and the move was indeed very successful.This is what I enjoy, watching the lines coming true, month after month, year after year.Best To allLe Cubiste:bows:"
222,"- from Harmen Mesker, no less. You can browse the cards here, and purchase them from here."
223,http://www.biroco.com/yijing/deciphered.htmSergio
224,"More about time in the Yi Jing and commentaries and yet no trace of the future....http://www.biroco.com/yijing/Tracing_time_Yizhuan.pdfOf course, from Mr. Marshall's extensive archives. Hard to leave no stone unturned...Sergio"
225,"I have written a piece on the Universality of the I Ching. I decided to post this because it is such a fundamental question. The post is too much to put here so if you are interested, you can link to it at http://www.lecubiste.wordpress.com. Please feel free to direct questions to me here, though emailing is good too.Best to All,Neil Sinclair"
226,"This is a really interesting book about applications of I Ching concepts in military strategy, and Baguazhang the internal martial art with roots in the great classic. This can also be extended into strategies for everyday conflicts on a personal level. Of particular interest are his expositions on Chu Ko Liang's arrays in military campaigns. Although useful in a long term conflict this material seems to me quiete useless in hand to hand combat where the dynamics of the situation demands quick reactions rather than planification (unless you are a professional and it is still of relative help in here too) However, interesting reading indeed showcasing yet another facet of the great book.http://www.amazon.com/Strategy-Change-Examination-Military-I-Ching/dp/1432750550Sergio"
227,Interesting book on the I Ching by Alberto Ramon ( plus blog)http://thelogicofchance.com/book-on-i-ching-interpretation/Sergio
228,"At Steve Marshall's site.The Maqian keI've just put up a translation and commentary by Steve Moore of the Maqian ke  [PDF], a curious prophetic text attributed to Zhuge Liang incorporating  hexagrams. This monograph was originally intended to be the third in  the occasional series of 'Oracle Papers', but it is being published for  the first time on Yijing Dao instead. (The first 'Oracle Paper', again by Steve Moore, is also available on the site: Structural Elements in the King Wen Sequence of Hexagrams [PDF]).    It's been a while since the last update, but the links page is always being added to, in case you haven't checked it out for some time.Click to expand..."
229,"My all-time most wonderful tool is Wenlin. The complete Yi is in it, and many other texts, and pointing at a character is enough to translate the Chinese to English. Clicking on it gives the OB character, and a lot of other information. That is not the only thing it can do, but for me it is the most important one. Find out all about this new version 4This morning I got a mail, that it costs only $99 for a limited time. I never advertise anything, but this one is an exception. This is the upgrade: To take advantage of this offer,  please go to www.wenlinshangdian.com. At the  end of your order, please enter in the discount code: ER39ug4. This will bring  your purchase price to $39 USD per upgrade copy.Or the complete version: The regular retail price is $179 but for a short time I’m extending the purchase  price of $99. If you’d like to take advantage of this offer (or share it with  your peers), please go to www.wenlinshangdian.com and  place your order. The discount code for the Wenlin full version is  ER4intL99. (The ""I"" is Elisabeth Ranhjan from Wenlin)http://guide.wenlininstitute.org/wiki/What_is_New_in_Version_Four"
230,"Dear Group;There are four new articles available at the Center for Zhouyi and Ancient Chinese Philosophy, particularly an excellent one from Prof. Liu Da Jun.Enjoy.http://zhouyi.sdu.edu.cn/english0/index.aspSergio"
231,"Over at http://www.ichingoracle.com/, Carol Anthony's new book, 'I Ching, the Oracle of the Cosmic Way', is available to pre-order (with a modest offer of reduced postage). There's also a sample from the book , Hexagram 3, which I think must give a very clear flavour of the whole. Any comments?"
