,content
0,"Update for 2021Things may be getting back to 'normal' to some extent, but it would be a shame not to keep these gatherings going. 'Normal' seems to be a way off yet for most of us, doesn’t it? Let's keep on meeting -  every other week, on Thursdays (starting on the January 7th). As always, the live gatherings are open to both Change Circle and WikiWing members, but the recordings will only be available inside Change Circle.~~~~~~~~Since we need connection now more than ever - to Yi and to one another - Clarity will be hosting some extra weekly  fortnightly (every-other-week-ly) video chatsWhat it isWeekly Fortnightly, hour-long video chats about Yi and readings.(And occasionally about something Yeekier, such as nuclear hexagrams.)Who it's forNormally meetings like this are just for Change Circle members, but these are for everyone in Change Circle or WikiWing. That way we limit it to people who are genuinely interested in the Yi (probably a good idea in these days of 'Zoombombing') but cost won't be a barrier.WhenMondays Thursdays at 6pm UK time. Click here to see what that is in your own timezone.I don't know how long the calls will continue for, but at least until the end of April they're too good to stop yet.WhereZoom video chat. A month ago I'd have needed to explain what that is... probably not so much now, right? I've been using it for classes since before they were famous  ; it works beautifully and is nice and easy to use.I'll be emailing the room link round to Change Circle and WikiWing members right away.How to share a readingI do much better with readings if I have a chance to think about them for a while and let them sink in. I don't think I'm alone in that, so let's share readings in advance of the calls. Here's how:If you are a member of Change Circle or WikiWing, and have a reading you'd like to share...and if and only if you are definitely coming to the next call...then please post a link to the reading on this thread.We don't want this thread to fill up with reading interpretations, so please just post a link to your reading thread in Shared Readings or Reading Circle.(Change Circle people - that means you can link to a reading in 'Reading Circle' and know it won't be shared beyond CC plus those who turn up to the call.)Last edited: Jan 4, 2021"
1,"I have uploaded some Imperial China era  charts to the Contemplating I Ching website, including Hexagram Order circular chart, Fuxi (Shao Yong) Chart (circle + square), Palaces Chart (i.e., organized by bottom trigram), and a handy Nuclear Hexagrams chart (circular). Look on ""Resources"" page. Will add more as time goes by. Enjoy!BarbaraLast edited: Jul 7, 2018"
2,Denis Mair has very generously given permission for me to host all his Yijing articles here for us to download. Here is the download page.It's basically the Yijing version of this. Enjoy.
3,"Dear all,At last, here is something I promised a long time ago but seemed to find no time to dedicate to it and finish. The problem was compounded when some of the concepts discussed in Part 2, Section 10, ""Times,"" needed a background explanation. Said background is found, in part, in Part 1, Sections 15-31. (Pay attention, for example, at the part where a proper structure for questioning the oracle is presented.) That added quite a bit to the translation. I have also opted to keep both files separate with links to each other. Many of you have asked for a practical way to ""time"" your Yijing consultations, without obtaining a PhD in Math. Well, here it is. This is the system used by our friend Jesed every time he tried to help someone in the Shredded Readings section, before he got tired of all the useless bickering (including random threats of witchery, that are forever part of the ""Clarity Annals""... )Mr. Andreé's ""Tratado I Ching, El Canon de las Mutaciones: El Séptimo Tiempo,"" is, In my opinion, one of the best --and open--, kept secrets in Yixue. The way the work is presented, and depending on their religious bent, is either very appealing to some students or easily dismissed off-hand, due in part to the somewhat dogmatic way it is presented. Mr. Andreé, whom was born in Chile, had a career as a journalist in Europe for many years, is a professor of ""Comparative Religions,"" a writer and poet, has had a few decades of Yijing study and practice. Even though I believe he's got good command of a couple of other languages, all his work is written in his native Spanish. I've always had mix feelings about Mr. Andreé. Much in the same way that Carol Anthony has presented her work as expanding explanations and meditations upon the Wilhelm translation, Mr. Andreé has also taken Wilhelm, whom he values above any other translation, and ""expanded"" the work. A good quarter of the book is about explanations and meditations like the ones shared here in translation (a very small portion of them, to be sure). The rest of the ""I Ching Treatise"" is dedicated to the 64 Hexagrams and their explanations. He's got many interesting hexagram interactions, such as ""Ambushed Hexagrams,"" which tend to take over the ""time"" indicated by a resulting hexagram, etc. However, when I speak about my ""mixed feelings"" they are mainly due to my own rebellious self which have always shunned those that call themselves ""Masters"" and have ""following disciples."" He also considers himself a priest and his teachings are a mix of Christianity and Yijing focused philosophy. His prose is filled with allusions to ""Saints and Sages,"" for example, though no Christian saints are mentioned. At the beginning, I almost disregarded his work, mostly on the account of some of his ""disciples,"" a few of whom, other than Jesed, have crossed through the halls of Clarity in the past. (If there is something I dislike more than self-appointed masters, are the zealots that follow them without a clear understanding of what the teachings are about...). Over the years, however, and by following his work, dedication to his causes and his predictions, I have come to understand that the scale tips, heavily, on the positive side. And no, I don't subscribe to his philosophical mixture. I do respect it though, as the path he has chosen to walk and teach to others. His work is, indeed, unique.Regarding his predictions, well, he's on record of making very accurate ones related to Chilean and world affairs as well as natural disasters such as the ones that struck Chile in the last few years. The timing method described in my translations is quite useful and accurate. For those interested, there are many examples here in Clarity of the method being used by Jesed. He has always applied the method to a dot and got mostly shooed away by wispy fortune-telling ""intuition.""The ""I Ching Treatise"" isn't a ""little book""... Below are a few pictures I took this morning (that's a 26in monitor behind it). It measures 11x8.5, has some 600 pages and is hand-sewn to boot! About the size of a phone book... Oh, and it comes with its own hand-crafted yellow cloth bag for storage. A couple of disclaimers:1. I hope you'll excuse the quality of the translation itself. I've tried my best to translate some of those philosophical concepts from the Spanish but, as you can imagine, it isn't an easy task (the reason I try to understand them, when exposed, in their own language). While I've tried hard to be true to the original, there are some terms used that do not translate well into English. I'm certain it needs some heavy editing but I've no much time for that. My apologies. However, the message is there, and a promise is a promise, albeit slow in coming. 2. I will not entertain arguing with anybody about the validity of the method or Mr. Andreé as its messenger. You either like it and use it, at your own risk, or you don't. Simple as that. I have my own opinions and experiences but I fly no flags for anybody.Sorry for the long wind. This isn't even an introduction to Mr. Andreé's work but something was needed as a background. Without further ado, here are the links:Ricardo Andreé's ""Times""Ricardo Andreé, I Ching Treatise, Part 1, Sections 15 to 31-English​I hope you'll enjoy them and, indeed, find them useful in your consultations.Cheers,Last edited by a moderator: Jul 5, 2012"
4,"Greetings All,    I have  posted a complete explanation of the King Wen Sequence of the I Ching hexagrams in a new page  accessible from my website page on the Flux Tome Perspective Upon the I Ching: www.stars-n-dice.com/fluxtome.html   or directly www.stars-n-dice.com/tetraktys.html .The difference between my explanation and the others about is that mine is not based upon the King Wen Sequence being set up as 32 pairs by line structure. It does not put the hexagrams on a number line, or in a circle or along a curve of any kind. It does not assume there is anything unique to any Chinese commentary or mathematical system.Instead, my explanation is based in the philosophical framework of the Pythagorean Tetraktys or the view that a complete analysis of any subject can be made in ten specific points grouped into a  1- Monad, 2-Dyads or linear polar opposites, 3 stages of process or narrative, and 4-Tetrad of perpendicular double dichotomies.That a single Sequence fits  the 32 pairs by line structure and the Pythagorean decad analysis of the Tetraktys, and all the other mathematical and philosophical conjectures folks have developed is simply a testament to the mystic poetry of the King Wen Sequence which works from whatever perspective one might choose to employ.The benefit of the Tetraktys matrix to explain the King Wen Sequence is that it is so absolutely and totally philosophically satisfying. It has no issues of how well does it fit the algorithm, are these math or landscape points the truly right ones. It just fits into place seamlessly. However, try it out yourself and see what you find.  A bit of background on my perspective and its development:   In the late 1970's I had the opportunity to teach an astrologer friend of mine in Belgium the basics of the I Ching. In the course of our  hours of study, it suddenly occurred to me that it was now quite simple to repeat the original insight of determining the meaning of each hexagram from just the line pattern of Yang and Yin lines.The fundamental principles to achieve this clarity about the hexagrams is to make a change in perspective from the standard view of hexagrams being composed of independent Yang and Yin lines. Instead the principle is that the gua (hexagram or trigram) is a  gestalt matrix whose background state is the set of Yin line places. A trigram or hexagram is thus a matrix background which is represented graphically by all Yin lines.    The individual hexagrams are formed as the open space between the pieces of the Yin lines is either filled in as a Yang line or left open to remain gestalt background called a Yin line.The meaning of the individual line places are illustrated and explained by the Pythagorean Eidos (dot-patterns on the dice cube) from first sprout or root to structure or stem, to passion or line of development, to 4-heart or soul of inner space, to 5-complete individual organization and Self, to 6-the flower or seed pod that opens the transition to the next situation.The meaning of the hexagram arises from 2 simple principles: There is a natural structural motion from line 1 up through line 6 (the Yin process). There is a a specific dynamic from a Yang line place toward an open Yin line place.Putting these together one can understand and explain the meaning of each hexagram. One example--hexagram 3, the first and 5th line places only are Yang. The only focus is upon the beginning and the overall organization, everything else is background. This is the situation of the first application of the chisel to carve the marble sculpture. The artist has the overall plan in mind and the chisel point has begun the transition from mental image to concrete reality. Difficulty at the beginning or Strikes.After working on my Flux Tome perspective, publishing several books on the topic, and reading the Pythagorean Sourcebook and Library by Guthrie (ISBN 0-933999-51-8) I realized that the brief comments in Wilhelm hex. 11 and 41 about the King Wen Sequence being in sets of 10 which is the same decad arrangement of the Tetraktys.Looking at the hexagrams ending in 1 (1,11,21,31,41,51 and 61), starting with hexagram One Ch'ien I saw even its Chinese ideogram name referred to the concrete imagery of the  water cycle. Those first 10 hexagrams are each composed by trigrams which illustrate the water cycle from their traditional nature images: sunshine, earth topography, thunder, rain, mountain, wind and finally lake. The water cycle starts with and is fully energized and explained by the action of sunshine to produce clouds that form water that flows over the earth until it reaches the sea.The big twist is to read the King Wen sequence like a poem, that is to not get hung up with the rhymes or line value pairs; rather to keep to the philosophical matrix taking hexagram one alone as monad, two and three as polar opposites of the Planet Earth topography and the thunderstorm energy that strikes and starts the rain fall. Then the Triad narrative process of hexagrams 4-5-6 beginning with the energy given to rain falling upon a mountain to produce artesian springs or rushing torrents;  central core of the water vapor in the clouds that will eventually fall over the Earth topography and pick up that energy of elevation--and finally the rain water falling through the sunshine, no longer controlled by that energy and now controlled by its elevation over the topography.Then the final Tetrad of the double dichotomy of perpendicular axes- 7 and 8 as water absorbed into the earth and 8 water flowing along the topography. And 9 the weather systems in the atmosphere that control the motion and elevation of the clouds finally ending the entire set of 10 with the low point of the topography that fills with water where it sits quiescent under the sunshine ending one water cycle and starting the next.Q.E.D.Check it all out for yourself through www.stars-n-dice.com.Dr. Frank R. Kegan :bows:"
5,"Hello community! Does anyone know if it's still possible to find a printed and bound copy of Hatcher's translation? I'm aware I can download it for free, but I'd really love a print copy. Thanks in advance for your help!"
6,"...is tucked away on her website so you might not have found it. Here it is:LiSe Yi-blogwww.yijing.nlThe latest post is on unchanging hexagrams; before that you'll find little gems about tigers and leopards, moons, mares and turtles. Enjoy."
7,"Dear fellow students of the I Ching, In my life as an artist who makes handmade books in very small editions, I created a book to illuminate the hexagrams of the I Ching using poetry and photocollage. It has two spines at the top and bottom which enables the reader to match upper and lower trigrams, and then see the images associated with those trigrams as a pair, or hexagram. (Hope that makes sense.)It is titled “Later Heaven”, and here is a link to view it online:http://www.danadanadana.com/laterheaven.html"
8,Does anyone recall any movies that have a strong influence coming from the Yijing? Or even a mention of the Yijing in the movie that gave you a sense that the director knew something about it? Or a documentary about the subject like Beyond_the_veil's find -http://www.onlineclarity.co.uk/friends/showthread.php?t=13837  I guess I'm just in the mood for a good movie.   
9,Roy Johnson - yogabyroy here at Clarity - is running a Zoom session this Sunday on essential oils and the I Ching.Sunday 6th December3pm Eastern Time Contact him for the Zoom link - start a private conversation here with 'yogabyroy' or private message him on Facebook.
10,"59.5 > 4Dispersing Childhood (Huang)Some of this from 4 is a carryover from my query last Saturday that asked ""What this week?"", to which I got 20.2.4 > 6.Whose zhi gua for 20.2 is 59, again Dispersing.I won't get into the first reading here (20.2.4> 6) except to say that I understood it to mean a time  to 20. 'Contemplate'(W/B) (Reflect, mine) on the conversational 6. 'Conflict' I had with a friend over politics the week before, and who, according to the reading, I should go 'halfway ' by forgiving his name calling,  6. 'A cautious halt halfway brings good fortune. Going through to the end brings misfortune.', (W/B), but stop short of reconciling with him, (going through to the end) for reasons of personal protection and avoiding any further haranguing.The new reading sheds further light on the first in that 59. Perseverance furthers ie. Stick to my guns, and not to ""seek the young fool"" (W/B) 4. and again continue to persevere and 'foster (my) character','giving no more instruction' to 'the ignorant (who) seeks me, (concerning a previous reading I did for him over a year ago, of which advice he has ignored repeatedly).The other aspect of 4. Image leads me to believe I should be 'mak(ing) every effort To cultivate virtue with resolute deeds'. (Huang).I believe this refers to 'Dispersing Childhood' memories through working with other adult children in a 12 srep fellowship out of a workbook that I ordered yesterday morning early. ie. Using the 12 step workbook to disperse or spread information about my childhood to the proper qualified persons to achieve further recovery.4. Image says:'The superior person makes every effortTo cultivate virtue with resolute deeds.' (Huang)I checked Wrbster's dictionary for these terms and the answer I got was, in my words:""I should use the ACA Workbook to 'speak out loudly'  (59.5, Huang) and spread widely ('Dispersing') what's close (or even intimate) to me about my childhood ('king's belongings'), and so act with firm determination to improve my strength and manliness of character.""Thus, ""Dispersing Childhood"".Comments?I apologize for not being able to post the link here instead of the text. I don't know what happened.  @hilary ?Last edited: Nov 12, 2020"
11,"New blog index pageI’ve just added a dedicated blog index page to the site’s menu. (You’ll find it under ‘blog’ and also under the search icon for good measure.) You can use this to scan a compact list of all posts, or filter the list by category or series. You’ll also find a tag cloud at the top of the page, which is the quickest way to find all posts that mention a particular hexagram or topic.I hope this’ll make it easier to find what you’re looking for in the archives. They turn out to be… extensive. (This is post number 901.)I’ve had a lot of help creating this, for which I am hugely grateful!"
12,"The Tenth Wing, the Zagua (Ts'a-kua) is of unknown origin. It is a mnemonic poem for a hexagram order that is ""scrambled"" compared to the received order (which itself has a puzzling order). The Zagua is translated in its entirety in Legge and Rutt.I've posted a PDF of the two orders here (mid-page) so that people can study them side-by-side, and a short blogpost about it here.Will be interested to hear if anyone has any theories about itLast edited: Sep 14, 2020"
13,"just a quick note to say that last night my web host has lost my site, The Changes: will advise when we're back online"
14,"UPDATE: Harmen's June workshop is filled, but he is offering another session starting Sept. 2020.8-Week Online Workshop ‘The Power of the Hexagrams’ Starting September 21, 2020, offered by Harmen Mesker. Cost: $195 USThis workshop will be looking at the hexgrams, trigrams and lines: The workshop will focus on the hexagrams and their composition. You will be challenged to work only with the hexagrams and their structures, and to put the text of the book (the Yi) aside. Working only with the hexagrams without resorting to the text is a very old practice in China. It is part of the xiangshu way of Yijing study that has been practiced for more than two-thousand years. Note: The text of the I Ching (the judgements and lines) are also important and vital, but they are not the focus of this workshop. You can find more information and sign up for the workshop here.The workshop will include:Weekly lessons posted online, including reading materials, videos, examples, assignments (with feedback), etc.There will be an online forum where you can interact with Harmen and with other students.Participants will have an additional three months access to the online learning environment and the materials.Harmen hopes to include a few video 'chat' sessions, but these have not yet been scheduled.Notes: * Registration has two parts: you register, and you also have to pay through PayPay. Make sure to do both! * Just above the registration form, there is a link. 'Click here to see a detailed list of the weekly lessons and their content' where you will find details about what's covered each week. I recommend you take a look, to get a better sense about the workshop and what will be covered. About HarmenHarmen started his study of the Yijing in 1982. His main interests are the history and language of the Yi, as well as the oldest usage of the book in early China. He recently started a YouTube channel - YiTube - which has videos on all aspects of the Yi. On his website www.yjcn.nl he shares his latest projects as well as an ongoing research journal on the text of the Book of Changes.Last edited: May 31, 2020"
15,"New Resonance Journal versionIf you’ve opened your Resonance Journal today, you’ll have noticed the ‘Update available’ button is active. Click it! Your journal will update to version 2.5.1, which includes some nifty new features.If you don’t have a copy of the Resonance Journal, you can download a trial from here. It’s available for Windows or Mac computers – not for phones/tablets, though, sorry.Default entry typeAre about 96% of your entries Yijing readings? (Same here.) Then you can select that as the default entry type. Go to Tools > Settings and you’ll see the new tab for this. Select the type you want and click ‘close’ –The next time you start typing an entry title, it’ll set your default entry type automatically.(You’ll also find that when you’re creating an entry, you can see all the items on the list of entry types without having to scroll, so that saves you another click!)Automatic image resizingThe Resonance Journal has supported adding images for years, but we’ve made this much quicker and easier now you can resize the image inside the program.Use Alt+I as usual to insert an image (or Insert > Image from the main menu) and you’re given the option to insert your image at original size, small, or shrunk to fit the exact width of your entry, like this –New time fieldJust to the right of the date field, the Journal now also records the time of your entry. That’s going to be especially useful if you practice a form of divination where the time of casting is important, like horary astrology. (The date and time fields are filled in automatically when you create an entry, but you can also edit them if you’re recording a reading later.)And some more friendly touches…Not new features, just little things that should make your Journal quicker and easier to use…Mac users will find program shortcuts make better use of the ‘Command’ key.If you have a big HD monitor, go into Tools > Settings and pick the new XX-Large interface style for better readability.As well as linking to entries and websites, you can now also link to a file.Export to Excel now includes your entries’ tags.Enjoy the new version! (And don’t hesitate to let us know via the helpdesk if you have any questions.)"
16,"Has anyone information about Chou Shan-pei and his Yijing commentary?He is mentioned by Wei Tat, who describes his commentary as 'a masterpiece': the only authority I have so far encountered [this is circa 1967] who explains the text in accordance with the “Principle of Analogy or Correspondences”. Chou's commentary is titled Chou I Tsa Kua Cheng Chieh.Google turns up three possible references, each to a late C19 provincial official in Szechuan: in one,  he's ""frivolous and fond of creating trouble;"" in another, he's an acting judge attempting crisis conciliation; in the third, he's a Protestant addressing a missionary conference. He may be all three; the last fits best:We Chinese have a saying that ""where there is no skin the hair cannot grow"". Now, the church member may be compared to the skin; the propagation of truth, the schools, the hospitals, and all the teachings which lead to the progress of virtue and the attainment of knowledge, are the hair.""""Chou shan-pei"" in Google will bring up the three sources:  Despatches...  Flowery Republic  Forgotten BooksCheers, The Changes renovating, slowly"
17,Temple of the Singularity. Home of Zhou Yi Dao MeditationTemple of the Singularity Blogtempleofthesingularity.blogspot.comno more active but there is still a lot.
