,content
339,"""This time, instead of revealing the heaven’s secret or omen in the explicit manner like in previous occasions over the past few years, one would present it in the form of a Guan Yin qin (divination slip) adding on an ‘ancient’, to assist clarity. (I have tested it two nights ago, and there was no usual rumbling from Heaven.)It could also provide an opportunity for the esoteric, Yi aficionados and Daoist devotees to ‘crack’ their heads over what is the revelation – the heaven’s secret. Readers can try to decipher the message(s) from heaven and comment, if they so wish.""  - Allan Lianhttp://atouchofancientszhouyi.blogspot.com/Allan Lian on July 17, 2009:Completing the four seasons of 2009 ""...The future can be foretold. Omens can be received. Heaven hold many secrets. All these can be known by consulting the Zhouyi. Over the years, one has blogged enough to prove beyond any reasonable doubt that it can be and has been done. Pigs and fishes may still remain unconvinced. But revealing omens and/or heaven’s secrets too often, has its drawbacks. Even divinities (Daoist deities and celestial immortals) have their limits, the Yi had once told me. While lucky enough not to be struck by lightning, it can damage one’s health or pockets. The loud encroaching thunders can be rather frightening, especially when it is not raining, while one types out the secrets for blogging.After giving out the omen on the wind borne diseases and the air disasters, the Yi had wanted to tell me something else. Upon consultation, the prognostication given seems to be another omen or heaven secret to complete the four seasons of 2009.This time, instead of revealing the heaven’s secret or omen in the explicit manner like in previous occasions over the past few years, one would present it in the form of a Guan Yin qin (divination slip) adding on an ‘ancient’, to assist clarity. (I have tested it two nights ago, and there was no usual rumbling from Heaven.)It could also provide an opportunity for the esoteric, Yi aficionados and Daoist devotees to ‘crack’ their heads over what is the revelation – the heaven’s secret. Readers can try to decipher the message(s) from heaven and comment, if they so wish. Spring winds borne diseases. False hope and black hands hide heaven.Summer air disasters. No parts or poor maintenance. Autumn rains rockets. Watch the south east region.Winter drum beats in the distance. Pigs cry, fish laughs, and cranes fly home. Ancient (Gu Ren) for the latter two seasons: Guan Lo advises Cao Cao not to move. Allan Lian's blog of the 17th  clarifies   a warning on July 12,2009:Moving heaven and earth The ancients say that sincerity is part of human nature. And that sincerity is the way of heaven. According to the Doctrine of the Mean (Zhong Yong), there are different levels of sincerity and the most complete of it allows the Yi diviner to divine like a spirit (shen). The Judgment in Hexagram 61 Zhong Fu / Inner Truth says:Inner Truth. Pigs and fishes. Good fortune. It furthers one to cross the great water. Perseverance furthers. Commentary:Pigs and fishes are the least intelligent of all animals and therefore the most difficult to influence. The force of inner truth must grow great indeed before its influence can extend to such creatures. In dealing with people as intractable and difficult to influence as a pig or a fish, the whole secret of success depends on finding the right way of approach. One must first rid oneself of all prejudice and, so to speak, let the psyche of the other person act on one without restraint. Then one will establish contact with him, understand and gain power over him. When a door has thus opened, the force of one’s personality will influence him. If in this way one finds no obstacles insurmountable, one can undertake even the most dangerous things, such as crossing the great water, and succeed. [Wilhelm / Baynes] If you have ever visited pig or fish farms, you may find that pigs and fishes are happiest when it comes to feeding time. Just like humans, creatures need to eat, to fill their empty stomachs. To the pigs and fishes, their owners by feeding and taking good care of them are sincere. This can also apply to reliable teachers and students. Nine in the second place means:A crane calling in the shade. Its young answers it. I have a good goblet. I will share it with you. Confucius says about this line:The superior man abides in his room. If his words are well spoken, he meets with assent at a distance of more than a thousand miles. How much more then from nearby! If the superior man abides in his room and his words are not well spoken, he meets with contradiction at a distance of more than a thousand miles. How much more then from nearby!Words go forth from one’s own person and exert their influence on men. Deeds are born close at hand and become visible far away.Words and deeds are the hinge and bow spring of the superior man. As hinge and bow spring move, they bring honor or disgrace.Through words and deeds the superior man moves heaven and earth. Must one not, then, be cautious? The great sage advised that in our dealings with people and/or nations by way of speech, writing and/or action, the Junzi have to be sincere, reliable, and cautious. Since their words and actions can move (gan dong) heaven and earth. If their sincere words and deeds can begin to move heaven and earth, do they not have the same effect with pigs and fishes?Just like the current handling of the two ‘nuclear’ nations by world leaders and the UN Security Council, if they do not put in more sincerity that can even influence pigs and fishes, they may realize too late what they should have done to avoid an omen or heaven’s secret given by the Yi.""Last edited: Jul 19, 2009"
340,"I suppose that if it isn't initiated by the Chinese it wouldn't be ""comprehensive"" Ancient Confucianism books to be translated into 9 foreign languagesBEIJING, July 27 (Xinhua) -- A team of international experts is to translate the essential books of Confucianism studies, ""Five Classics,"" into nine foreign languages.    The ""Five Classics,"" or ""Wujing"" in Chinese, is a body of five ancient books about Confucianism studies.    The five books are: Yijing (Classic of Changes), Shijing (Classic of Poetry), Liji (Classic of Rites), Shujing (Classic of History) and Chunqiu (Spring and Autumn Annals). The last one is said to be written by the great philosopher and educator Confucius himself.    Until now, there have been no comprehensive foreign language translations of these books.​"
341,"Excellent article from Steve Marshall on John Cage and his use of the I Ching in his music compositions and Paintings.Check it out,folks!http://www.biroco.com/yijing/cage.htmSergio"
342,"Merce Cunningham, Who Reinvented Dance, Dies at 90Merce Cunningham has died...Last edited: Jul 27, 2009"
343,Questions About the I Ching and the Way
344,"Very recently, there was a series of conversations in the Midaughter's mailing list about the concept of Yin-Yang and how it applied to the Yijing; a sort of chicken-and-egg discussion, and unfinished, IMO. I contributed an excerpt from Lars Berglund's PhD dissertation, ""The Secret of Luo Shu,"" that I typed and made available in Google Docs. Here is the link:The Ancient YinYang-ConceptA few surprising posts in there. My thoughts are that the Yin-Yang/Wuxing concept--something not compiled, but existing, until Zou Yan put his elaborated ideas down in paper (now lost, for the most part)--, is much more ancient than the Zhouyi proper. Perhaps the genesis of the Zhouyi might be unrelated to the correlative thinking underlying the Yin-Yang/Wuxing concepts but they did fuse together under the canonized Yijing and the exegesis that followed."
345,"I think this is a very interesting overview of Prof. Schultz visit to Prof.Liu Dajun Center.It seems Prof. Schutz has devised yet another order for the hexagrams.http://zhouyi.sdu.edu.cn/english0/partyInfo/2009DrSchultz.aspSergioP.S.:Check the diagram's photo for a ""sneak preview""..."
346,Interview with Thomas Cleary
347,Fresh from professor Liu Dajun's site:http://zhouyi.sdu.edu.cn/english0/newsxitong/selectedPapers/2009624190743.aspSergio
348,"Just came across ""Seeking the Spirit of The Book of Change"", 8 Days to Mastering a Shamanic Yijing (I Ching) Prediction System by Master Zhongxian Wu.  Published by  Singing Dragon .  Not had any time to do more than flick through the pages but it seems to be based on the trigrams.  It wasn't supposed to be published 'til July, but there you go.  Does anyone know this author?  Bob."
349,"Hi All,I have put a working example of my Oracle Blank onto the web page:http://www.stars-n-dice.com/yioracle.htmlThe new part is that it gives trigram interpretations from the Oracle and Resultant Hexagrams for:Desires felt As: lower Nuclear trigramDesires Seen As: upper nuclear trigramFeelings: lower Oracle TrigramGoals: upper Oracle TrigramActions: lower Resultant TrigramHopes: upper Resultant trigramThere are also line pair slogans for the Heart (3 & 4) line pair; the will line pair (2 & 5) and Environment line pair ( 1 & 6)Also the developmental process from Nuclear Hexagram to Oracle Hexagram as well as interpretation sketches for each hexagram, nuclear hexagram, corner hexagram (the nuclear of the nuclear--always either the first pair or last pair of the KWS)I have not put the matrix to determine hexagrams from their line pairs, so one needs to be able to find a Yi hexagram from its line pattern on your own.Enjoy!Frank"
350,Very good article by Steve Marshall about filings for I Ching patents:I Ching patents
351,A review by Steve Marshall of John C. Compton's book:The I Ching Key: The Secret Computer of the Ancient Gods
352,"Hi friends!On coming June the 13th, we are organising an I Ching-event in Holland. This year it's all in Dutch, but who knows what the future may hold As for now, I'd like to invite all Dutch speaking I Ching adepts to check out the websitewww.i-tjingsymposium.nland come and enjoy the company of your fellows in a beautiful surrounding!Love, Femke"
353,A new novel with a Yijing flair...
354,"Dear Qi-friends,Greetings from sunny and flowering Portland! This will be my last seasonal letter for you. I will be reducing my social activities to concentrate on my personal inner cultivation and to focus on my traditional teachings for small groups and writing new books. But I'll try to keep writing a New Year greeting letter every year before I completely retire from general public teaching. Please check my website www.masterwu.net once in a while if you'd like to know about my future events. The warm sunshine reminds me that this summer is coming on May 5, 2009. My new book Seeking the Spirit of the Book of Change: 8 Days to Mastering a Shamanic Yijing Prediction System is coming along with the summer Qi and you can order it through https://www.paypal.com/cgi-bin/webscr?cmd=_s-xclick&hosted_button_id=5225124 or my website now. I'll have a book launch party at Bamboo Grove* in Portland, OR on May 21st at 6:00 pm. My publisher Jessica Kingsley will come from London to join the party. Some original scrolls of my calligraphy for the new book will be exhibited during the party. Please come to join us for a cup of tea, Qin music, and some stories about the book. The swine flu is threatening us now. Please keep up the daily Qigong practice to keep your immune system strong. Especially this summer, GI flu will affect many people. The energy of this autumn and winter will be difficult for those who have a weak heart and kidneys; therefore, we should never be lazy in our daily Qigong practice. Love and blessing,Master Wu*Bamboo Grove134 SE Taylor at 2nd Ave (SW corner, entrance on 2nd Ave)Portland, O R 97214"
355,"I've had this press release for a while but forgot to post it. I was reminded of it by a post in a forum of Spanish speakers in China announcing a conference Cristina will give in Shanghai on May 14.The cards can be purchased in Amazon.Cristina Bertrand is quite the multifaceted artist and entrepreneur, with beautiful Yi inspired painting, fragrances and even jewelry."
356,"I Ching: The Sequence of Change, by Robin ArmstrongBook I-Sequence of Change Introduction (310 pages)Book Two The Main text (547 pages)Book II-Sequence of Change-01-WinterBook II-Sequence of Change-02-SpringBook II-Sequence of Change-03-SummerBook II-Sequence of Change-04-FallBook Three, The Appendices: (2584 pages) Appendix 1 The Places Appendix 2 Genealogy Appendix 3 Light and Dark Appendix 4 True Numbers Appendix 5 Colour Appendix 6 Body Movement Appendix 7 Lines to Astrological Houses Appendix 8 Quaballah Appendix 9  Rhythms of Change Appendix 10 Melodies of Change Appendix 11 The Celestial Harp Appendix 12 Astrology Appendix 13 Chanting the Changes Appendix 14 Forest WoodhengeThis is an ebook on CD in PDF format. This is Robin's complete treatise on the I Ching, forty five years in the making of it.Some of the material in the introduction is what you see on the website (www.thewakingdream.net), but the graphics are in a more printable form (higher pixels). The main text is a new interpretation of each hexagram and line in the I Ching. One of the main unique factors in this interpretation is the all references to the superior man and his superior virtue and ethics have been removed. There is no male or female in the hexagrams. One does this or one does that. It is written to the individual in everyone who will run into freedom and responsibility and in the process with the help of this new version, might be able to stay out of trouble and free of blame.The main text also presents the hexagrams in association to the corresponding degrees of the zodiac. This opens up a vast new area for I Ching related research and studies. The text was also written to be more appropriate for astrological study and to allow for clearer psychological assessments.The appendices are a large part of the treatise, and cover the relationship of the I Ching to other fields of study. COST:I Ching: The Sequence of Change (complete - 1 cd with pdf files)   $30. Cdn  (plus shipping and handling)Shipping and handling in Canada and USA: $5.00 Shipping and handling internationally: $7.50You can contact me by clicking on the option to email above this post, or send me a private message. Thanks."
357,"After numerous, and what I perceive as continual attacks, I don't think it is in my best interest to continue on this site any longer.As I told Hilary, I do these reads for free, with hardly ever a thank you but I do get plenty of criticism instead.A certain reader here is always complaining, and now it has spread to a querent through her influence, so as you think after nearly 3,000 posts that I am mostly wrong then there is no point in carrying on.Answering querents questions has been very interesting and fun for me but trying to put up with certain permanent members of this forum has been a real struggle that at times has made me very angry. I don't need the hassle anymore.So, I now leave it to those experts to carry on if they can do it but I know that many querents questions will go unanswered.I have another home, that is much more friendlier than this one has ever been or ever will be.WF"
358,Cool site by artist Karolyn Y. Zeng:
359,"Hi,I wanted to share with you a new iPhone and iPod touch App, Yi Jing - Book of Changes, which I just released through iTunes Store, and am including the press release below.  Information can be found here:www.flatearthstudio.com/AppsI am seeking permission from authors of translations and interpretations to include their text in this new App.  If you are an I Ching text author, or if you would like to see a particular author's text in this app, feel free to contact me.  For more details on that, please visit:www.flatearthstudio.com/Apps/Contact.htmlThank you,- Brian---- (my press release) ----Yi Jing, the Book of Changes, is now available for the iPhone and iPod touch. The definitive mobile version of Yi Jing, or I Ching, the Book of Changes, done the way it was meant to be experienced. One of the oldest books written has been re-crafted to take advantage of the unique features of your mobile device. One single App contains all of the features you would expect to use with Yi Jing, including a question oracle, an integrated journal, and book text in multiple translations and interpretations.Ask questions:* Enter a question or phrase* Toss coins by shaking* Or use manual line input* Automatically saves questions with results in a journalManage a journal:* Browse saved questions by date* Search by keyword* View Present, Changes (lines) and Future Hexagram text* Add your own notes* Mail journal entries to yourself or someone elseBrowse the book:* Choose from multiple language translations/interpretations* Includes Chinese, German (Wilhelm), and English* Original Chinese characters and Pinyin phonetics* King Wen Hexagram numbers are indicated for easy lookup* Trigram descriptions and attributes are included* Zoom in on a Hexagram's component Trigrams* Zoom in on a Hexagram's Ruling Lines with description* Jump to opposite, inverse and mutual HexagramsOther key features:* Straightforward and elegant interface design* A Settings option to represent coin heads as Yin* A Settings option to cast coins with Yarrow stalk probabilities, where changing Yang is more likely, and changing Yin is less likelySupported Languages:* US English, German, ChineseSupported Devices:* All iPhone and 2nd-Gen iPod Touch devicesPricing and Availability:Yi Jing is available for only $2.99 (USD) through the Apple App Store. Please contact us for interview and/or commentary."
360,"I started an 'I Ching links' thread in a Facebook group, listed a few (here, LiSe's, Brad's, Ewald's, Jaliya, GreatVessel.com) and asked, 'What have I missed?' And in the next post...tsk tsk Hilary, you missed out on The Emotionall I Ching where we move the IC from the 10th century BC into the 21st century AD! ;-)The book will be out in about two weeks  - see sample overview at:http://www.lulu.com/content/paperback-book/the-emotional-i-ching/6393965and the website prototype is still active:http://members.iimetro.com.au/~lofting/Emotional/homep.htmlClick to expand...There you go. Never say I don't keep you informed."
361,"Dear Friends,   I have a new essay posted on Yijing Poetics, here:www.yijingpoetics.net/yjp/yjp1.html   I have also posted Jiao Hong's commentary on #24 and #61 here:www.yijingpoetics.net/yjp/yjp3.html    I also have a new section of essays in Chinese.    The site was re-designed and constructed by my brother Thomas, for which I am tremendously grateful.                             Regards,                             Denis MairLast edited: Apr 2, 2009"
362,"In my email this morning, from Fredda Laurel:Learn the I Ching  - The I Ching is an ancient form of Divination, originating in Chinaover 5000 years ago. Carl Jung, the famous psychoanalyst, called it a'manual for lovers of self-knowledge'. It is the oldest book inthe ancient Chinese library. By asking questions and throwing coins,the student is able to connect with their higher self and receiveanswers they need. The I Ching is of such significance that untilrecently every educated Asian was expected to know it. This class willbe held from 1-3PM. includes history, formulating questions andinterpreting answers.I have been a student of the I Ching for over 23 years. I currently lead an I Ching Meetup group on Capitol Hill. For more information, or to register: Please contact me at303-837-9246 or email me at: fklaurel at gmail dot comWhere: For Heaven's Sake, 4383 Tennyson.When: Sunday, April 26th, from 1-3PMThe $35 price includes handoutsClick to expand..."
363,"The Master said : ''Opportunities of time vouchsafed by Heaven are not equal to advantages of situation afforded by the Earth, and advantages of situation afforded by the Earth are not equal to the union arising from the accord of Men''.Fellow Yi students.    Labouring since 1992 at creating an Etymological Companion to the study of the Yi Jing, a common denominator issued from 84 world versions, I see more than ever that the toughest is always the last 100 yards. The 1353 pages included between its covers will require many months of exclusive dedication before I hand it down to Shambhala Books, time borrowed from my ''regular'' work (Anthropologist).   I therefore need a small helpful contribution from you to see it through and offer something unique in return.   The Yi Jing Study Companion's cover artwork will depict the 64 hexagrams as were found at Ma Wang Dui in Zhuanshu characters( the world's oldest Yi Jing). I have made these out of Chinese Ink on Rice Paper and wish to offer Clarity exclusive samples to help finance my dedication. These will never be seen anywhere else but on Clarity and only for one month ( since the editing is progressing daily).   These samples are full size 8 X 11 inches on Rice Paper and I offer them for $20 U.S including delivery anywhere in the World.   You should know also that it is my intension to secure some of the money generated by the book and the print and invest it in Clarity ( where we meet and share the wonderful world of the Yi Jing)...Thank you Hilary !   You may reach me here under member name confucius                                                 Chi chi                                                                 ConfuciusLast edited: Mar 18, 2009"
364,"Hi everyone,I have just dropped by to say hello.If you were wondering where I was, I was not travelling but in a very confining situation through no fault of my own and certainly not enjoying myself. It has been a very hard and expensive 80 days for me and I hope never to have to go through the experience again.I will be back answering questions very soon.WF"
365,"Hello All,The current issue of the literary webzine Ziyou Xiezuo has published an article I wrote in Chinese. I invite you to take a look:www.penchinese.com/zyxz/42/042mdl.htm       Regards,       Denis Mair"
366,Two new articles from prof.Liu Da Jun's site.http://zhouyi.sdu.edu.cn/english0/newsxitong/selectedPapers/2009215170952.aspSergio
367,"Jon Sandifer, who published with Wang Yang ""The Authentic I Ching,"" has a new site:I Ching Astrology"
