,content
99,"(Only 'I Ching News' in the rather loose sense that Clarity's about the I Ching and it has some news…)Here's a blog post about the upcoming redesign.To elaborate a bit... bright and early tomorrow morning (UK morning, that is), Audrey-the-expert will finish moving most of the site to the new design - basically, the blog and all the pages that aren't a) forum/ WikiWing or b) your account pages. Then I will fix the home page, and switch the forum to the new style. And once that's working I will do the account pages and assorted other tweaks. And I'll publish another blog post with a guide to the new site, to make sure you can find everything with no problem.In theory, this will all go beautifully smoothly. You'll just see the forum magically change to the lovely new design without so much as a hiccup. The top and bottom of the page will look very different - new images, new menus - but the forums in the middle will work just the same way.In practice, if it all looks like a dog's dinner at first, bear with me. The new forum skin has been working nicely as a test, but since lots of files it uses will be moved, I've had to change the links to all of those - and I won't be able to see whether I've got that right until after the move. The forums will keep working, though.Similarly for your account and membership pages, except that I haven't been able to test those with the new design at all - so while they will work, they will probably look funny for a while, until they don't.If, after any obvious dogs' dinners have been tidied up, you find mistakes/ bugs/ oddities, please assume I don't know about them, and tell me! Likewise if you're not sure where something has gone, please ask.Once I've tied up any loose ends, I plan to disappear on holiday for a couple of weeks... "
100,"Yi tends to shape people’s thinking, and when it gets hold of an artist or writer the consequences can be thoroughly*interesting…I mentioned Will Buckingham’s Sixty-Four Chance Pieces once before, but I’ll happily jump on this opportunity to recommend them again. These are 64 short stories, one inspired by each hexagram,*drawing on real knowledge of and insight into Yi and a true delight to read. (And maybe to use as a divination companion, as who knows what synchronicities might open up in response?)And… I’ve just heard of a new work*that looks very interesting: Changing, by Richard Berengarten. It’s a remarkable undertaking: a poem inspired by the whole Zhouyi, line by line. Here’s a pdf sampler that includes the first two hexagrams – though we’ll need to read the whole book to discover how much he’s been able to integrate of the Yi’s own internal architecture. I look forward to it.(If you’re in Chicago, there’s a book launch and reading from Changing in the University of Chicago’s Wieboldt Hall 408 on October 3rd at*4.30pm.)The post Yi as inspiration appeared first on I Ching with Clarity."
101,A travel diary in 4 parts:http://www.yjcn.nl/wp/going-back-to-the-source-the-manuscripts-of-richard-wilhelm-1/http://www.yjcn.nl/wp/going-back-to-the-source-the-manuscripts-of-richard-wilhelm-2/http://www.yjcn.nl/wp/going-back-to-the-source-the-manuscripts-of-richard-wilhelm-3/http://www.yjcn.nl/wp/going-back-to-the-source-the-manuscripts-of-richard-wilhelm-4-the-end/     Enjoy.     Harmen.
102,"Can't use IE now with this forum at all.  Hilary said to clear cache so I did but it didn't help so the only solution is to use Chrome which I'm not happy about.  Basically the forum on my IE browser froze about 5pm yesterday, none of posts will post and no new posts appear either.  I just tried to post in the IE browser and it says I have no access to the forum.  Am I the only one who cannot use IE to access this place now ?"
103,"I’ve just opened the (virtual) doors for a new I Ching chat service…What this isA 30 minute chat on anything I-Ching-related – a line you’re stuck on, a reading where you could really use a fresh perspective, an image or hexagram that keeps coming back, even a knotty problem that you can’t seem to resolve into a simple question to ask. That kind of thing.When I let the main I Ching reading service grow to the size it seemed to want to be – a month or so of in-depth exploration with weekly calls – this left a bit of a gap if you wanted some individual help with a reading but didn’t want a month-long, deep-dive intensive. I started offering I Ching chats for Change Circle members, and since this has worked well, I’ve decided to extend the offer to everyone.How it worksFirst you book a time, then you pay, and then you’re taken to a page where you can send me the details of what you want to talk about. That seemed the best order to do it in, to ensure you don’t pay unless you’ve booked a time that suits you.On the day, I’ll call you – by phone or Skype, whichever. Skype is preferable if you have it, because the sound quality’s better, but*phone works too.Three reasons not to book an I Ching chat1. You’re completely new to the I ChingConfident expertise*isn’t required, but you do need to be reasonably familiar with casting your own readings, so we can spend our 30 minutes*focussed on what you wanted to ask about, not distracted by technical details.(Of course, if what you want to ask about is a technical detail, that’s OK!)2. You’ve got a lot going on and need comprehensive helpIf you want really in-depth help, especially if you think it might take more than one reading, then you probably need the full I Ching reading service instead. In a small chat like this, I think less is more.3. You’re a Change Circle memberIf you’re a Change Circle member, this service is included as part of your membership. So use the Change Circle booking link – not the regular shop page, which would ask you for payment after booking.*(If you're not a member, you're welcome to join*- you'll be able to access the members-only booking page*immediately.)Here are all the details and the booking link for I Ching chats. If you have any questions, please ask!"
104,"What's happening?WikiWing is the I Ching Community's collaborative 'Wing' for Yi: a hexagram-by-hexagram, line-by-line commentary, based wholly on our own experiences in divination. It started life in 2008 with my own personal notes, and has been growing steadily through the years as people add more examples.Up until now, it's only been available to members of Change Circle. I'm going to change that, and create a separate WikiWing-only membership at a lower price.Why?In a nutshell: Change Circle is on its way to becoming the 'home' to all my courses and Yi-learning materials. Once complete, that'll mean putting its price up for new members - which would mean new people could only join and contribute to WikiWing by paying the higher price. That's not - at all - the idea behind it, so now feels like the right time to open WikiWing as something you can join on its own, to read and contribute.(To clarify - WikiWing will still be part of Change Circle, too. Change Circle people please note, you do not need to join it separately!)How?This isn't ready yet, but as soon as it is, there will be plenty of prominent links inviting you to join. You won't be able to miss it.To guarantee that this is affordable, I'm going to go out on a limb and try 'Pay What You Want' pricing. The best business advice says this is risky in general, and especially daft for a recurring subscription, but Yi is very encouraging, so here we go.WikiWing access - to both read and contribute - will be available as a monthly subscription. Pay what you want - what feels right to you. (The minimum monthly payment will be £1.)When?Soon! I've had to commission a new add-on to handle the 'pay what you want' subscription... that arrived this morning... and has a bug. So I need to get that fixed, and sort a couple of other technical things, and write some 'how to edit' help. If all goes well, I should be able to open the doors within 2 weeks....?(space for further questions below this post...)"
105,"The Designer's Book of Change by C.G. Garant is an interesting interpretation of the Yijing through the eyes of a teacher of design. It looks at the universal principles of good design and nicely draws wisdom from the Yijing to support those principles. The author has created a work of interest to all Yijing readers looking for balance and meaning.See our full review at: https://contemplatingiching.wordpress.com.BarbaraLast edited: Aug 2, 2016"
106,Just realized that Lars Bo Christensen has published a new translation:http://zhouyi.dk/  I find his commentaries on the Judgements and Lines very helpfull in all of their short simplicity in his recent work. Here He have given just the translation into english without commentaries. (I know that some preferr it this way)  This posting in case it hasn't been announced yet......
107,"Bettina Wilhelm is at it again. Looking forward to this tomorrow.The Secrets of the I ChingAnd yes, I'm still alive and well, as some friends from here, who read my brain droppings on Facebook, can attest... Carry on.L"
108,"Short version: here it is, with my apologies. (I didn’t know anyone still used it!)Backstory:A few years*ago I commissioned Ewald Berkers*(creator of the I Ching Community’s indispensable hexagram search) to make us a new online I Ching.I did so because the old reading, the one in two frames, created a lot of confusion for beginners. It always shows two hexagrams even when you’ve only cast one, so people get*the impression that*that an unchanging hexagram is*‘casting the same hexagram twice’. And it displays*the complete changing line texts of both hexagrams, leaving newcomers far from sure what’s actually part of their answer.The new reading*cleared up the confusion: an unchanging hexagram just appears as one hexagram, and only the relevant text is displayed. Also, since it casts one line at a time and displays the answer on a new page, it’s just a little slower to use, which in my book is a Good Thing. (And it*can be saved and exported to pdf and linked to…)I left the old frames reading around in case anyone wanted to use it, though I didn’t really expect anyone would. And then when I created the redesigned site, I called on Ewald again to make his reading script work with it (as a WordPress plugin)… and pretty much forgot the two-pane*reading still existed.Well… I live and learn…I’ve already had about 20 requests to put the old reading back. So, in response to popular demand, here it is. Restyled a little*to match the new site, and with the links corrected, but otherwise unchanged.I’ve included a link to this on the main free reading page*– tucked away at the bottom, under the ‘introduction for beginners’."
109,"or ‘Where did Hilary go?’For the last several months, I’ve been working on redesigning the website – which has been so time-consuming that really only Change Circle members have seen much of me. It has all taken just a bit longer than expected…But*we are almost there. All that’s left to do is the actual changeover to the new design. This is a bit more complicated than it sounds, so I’m getting a tremendously helpful expert to do the heavy lifting.What to expect on Saturday…Saturday 23rd*is Changeover Day, and there will be some odd moments: bits of the site looking different from other bits, links that lead nowhere, and so on. But everything should be working again normally within 48 hours or so. First the blog, then the main site, then the forums and finally your*‘account’ and ‘profile’ pages will be changed to the new design.…and afterwardsI expect I’ll spend the following*few-days-to-a-week doing the remaining technical chores and chasing down any unexpected bugs. (Just imagine me staggering blearily*about, waving a fly swatter.) If you could let me know about any issues you find during this time, that would be brilliant – thank you.And then I’m going to have a holiday. Not something I*normally do, but I think I need one. (Error 404, brain not found. Error 418*is also a distinct possibility.)And*then, when I’m back, I’ll invite you to have a look at the new ‘I Ching chat’ option. This is a quite different animal from the full reading service: it’s just a thirty minute chat to help you get ‘unstuck’ on a specific reading sticking point. The same service has been included in Change Circle for a while now, and*since that’s worked well, I thought I’d try making it generally available. More information coming with the new site…"
110,"As you can see… we have a new Clarity website. I really hope you like it! Here’s an explanation of the changes and a guide to the new site.Why change the design?Because the old one was old *– some nine years old, in fact – which means it wasn’t at all adapted for browsing on smartphones/ tablets. (You may have found it disappeared from Google search results on your phone – that would be why.) So that had to change… and while I was working on that, I’ve also tried to make it look a bit less like 2007.In the process I get to do something I always wanted: fill the site with images of the natural world, showing what Yi is and what it’s made of. When I started out, ‘site full of images’ meant ‘site no-one can actually load over their dial-up connection’ – but times have changed, and there’s no need for a site about the Yi to look like a site about a bank.The new header image shows the sun emerging from behind clouds – which is (probably) what the Chinese character yi*originally represented. Yi is change as in ‘a change in the weather’ and ‘the emergence of light’ – something I didn’t yet know in 2000 when I named the business ‘Clarity’.‘Life can be translucent’, says the header. That’s my idea of what Yi does – it opens up ordinary life so meaning shines through.What’s changed?Content-wise…Not a huge amount has changed. What I’ve done is to move things round and consolidate all the learning material in one place. So instead of a private free course for members and a bunch of public pages that sort-of more-or-less duplicate its material, there is a single free beginner’s course. You’ll find it (unsurprisingly) under ‘Learn’.There are still bonuses for free members. The difference: you don’t have to seek out a separate download area to find them, you only need to be logged in when you look at the course pages. On the same page, people who haven’t joined (or aren’t logged in) will see messages saying ‘Sign up to get this download’, while as a member you’ll just see a link to download it.If you’re on any page and not seeing what you think you should (eg if you’re a Change Circle member not seeing the full Foundations Course), click ‘log in’ at the top right.You’ll be redirected back to the same page afterwards, now displaying the right version for you.Navigation-wise…You no longer have to click over to ‘Learn’ to see what’s available there. Any main page is available from any other page – just mouseover/ tap on the main menu.Site search is also available directly from the main menu, and so is a contact form under ‘About –That’s on every page except the forum, where you’ll just see a link to the contact page.*Please use one of these if/when you find bugs!Finding forum thingsMouseover/ tap on ‘Community’. Here you’ll find a complete list of forums and – once you’re logged in – the forum search options, notifications, private messages and links to profile and settings. On a computer, you mouseover and then click what you want; on mobile, you tap a submenu to open it and then a link to access it.So everything that was under the ‘Talk’ tab is here, and so is most of what you used to access by clicking the ‘account’ link in the top right-hand corner. The exception to that: the log in form and the link to your main account page for Clarity as a whole (not just the forums) are still at the top right:Go to the ‘Your Account’ link at the top right if you want to –*see everything you’ve purchasedchange your passwordchange your registered email address (for forum notifications and product orders)change your username (that’s for future*posts – it won’t affect what’s displayed on your previous posts)delete your whole account at Clarity*Use the ‘Forum settings’ link under the ‘Community’ menu if you want to –*tweak how you appear on the forum – profile picture, the avatar by your posts, etcchange your forum signaturechange any of your forum preferences: skin, subscriptions, friends, private messaging etcaccess your bookmarks (CC members)To access what you’ve purchased…Log in, and then –You can look under the relevant tab: access Reading Circle, WikiWing, Yi Academy etc via the ‘Community’ menu; access the Foundations Course via ‘Learn’ and the ‘Treasure Chest’ extra articles via Learn > More tools – or from the ‘Change Circle’ home page under ‘Community’.You can also click ‘Your Account’ in the top-right hand corner of every page for… well… your account, which includes a list of direct links to ‘active resources’.Using the forum on your phone/ tabletI’ve had the menu adapted to be mobile-responsive in the forums too, so you may be quite happy using the forum just as it is. But if you’d prefer something simpler, there is a mobile skin you can choose as your default instead. To try it –At the bottom of the ‘Community’ menu, tap ‘Forum settings’In the left-hand menu under ‘My Account’ tap ‘General settings’In the very last section of this page, ‘Miscellaneous options’, you’ll find a dropdown menu for ‘forum skin’. Change that to ‘default mobile style’ and tap ‘save’ at the bottom of the page.This gives you a rudimentary, very quick and simple version of the forum: no links to the rest of the site, no ‘post thanks’, no settings page or hexagram search. Its main menu is the blue square grid icon at the top right.To change back, click ‘full site’ at the bottom of any forum page, and then make your way back to the settings page again to switch your default skin.If you find a bug…Then please oh please let me know. Click ‘About’ in the main menu and try out that nice, new contact form! Or visit this page at the forum*where kind people are already posting about bugs/ questions."
111,"An article in Shanghai Daily describes a custom-designed home based on I Ching. ""Designer Carbone said the client’s vision was to design a place of refinement and conviviality inspired by traditional Chinese culture and interior design principles. “We have worked very closely with ideas and motives from the Chinese classic text, the Yijing or ‘Book of Changes’. Wang wanted a special place for his friends and family to enjoy tea, entertain guests, listen to classical Chinese music and enjoy the astonishing views of the river and cityscape,” Carbone said."""
112,"An intriguing art show 360º I Ching, by the late sculptor Walter De Maria, based on the I Ching hexagram shapes, has opened in upstate New York. ""His work is more inscrutable and at the same time more open-ended than many of the artists in the collection...[viewers can see the] idea of a bounded limitlessness or infinity... and the vast knowledge within that.”The show takes place at the  Dia:Beacon Museum in Beacon, New York, and will be up until Summer 2017. See the full article in the Wall Street Journal."
113,"YiJingDao Lite 1.2 is a free Windows application, improved and without adds.YiJingDao Lite can run on most Windows versions, from Windows 10 to Windows XP.It has a modern YiJing translation with useful comments plus a dictionary with the meaning of the Chinese characters that form the original textThe Oracle can be consulted either with the coins or the yarrow-stalk method, using an animated interface.Oracle answers can be stored in a database, from where they can be imported or exported, to share them with others or for backup purposes. Trends in the Oracle answers can be analyzed easily by using the Analyze button in the database.Guidance for interpreting the Oracle answers is provided, so users can know how to interpret mutant lines.Besides the English translation, it includes the original Chinese text with a literal word by word translation of the Book of Changes.This feature is very handy for the serious YiJing aficionados, since only in that way the whole range of meanings of the Oracle answers can be unveiled.YiJingDao Lite is portable, after installing it on a folder, that folder can be copied to a USB Stick or to any other hard disk (In case the program is not installed, but copied, the two TTF fonts in its folder should be installed by the user).You can see some screenshots, learn more about the program, and download it at:http:/yijingdao.org"
114,"Here's a link to a review of Scott Davis' book, The Classic of Changes in Cultural Context. The book is full of challenging ideas about the structure of the Zhouyi, and proposes an underlying matrix for the hexagrams (both text and graphic)."
115,I've just posted a review of David Hinton's I Ching: The Classic of Change to http://www.contemplatingiching.wordpress.com. There are comments on another thread on Online Clarity about this book.Barbara
116,"This sounds interesting: a two day course in London on 9 Star Ki astrology and its roots in the Yijing. If you’re interested I would recommend getting in touch with the organisers soon, as they’re only taking six students. Click the image for more information:"
117,"In seeking to understand the origins of my aberrant understanding of Hexagram 44, I went searching for Stephen Karcher and found:http://inthefamilyway.org/iching/(The first I Ching translation I ever read was Karcher's work.  While I only studied with him in person for one week and have found more of a home here, I appreciate his contribution.  I especially like his understanding of Hexagram 44 and 54)Last edited: Mar 9, 2015"
118,"Margaret Pearson's The Original I Ching is a very engaging book with clear enough writing and ideas for beginners, but with some challenging new ideas and translations and commentary for experienced readers (particularly regarding women's roles in early China, and later gendering of yin and yang). Much food for thought. A full review is at https://contemplatingiching.wordpress.com/news-and-reviews/"
119,"http://www.memrise.com/course/20203/This app helps with memorization of various things (alphabets, languages, art, history, etc.) and features an excellent course on memorizing the Hexagrams of the Yijing. The link above is specifically for the Yijing lesson. The course covers being able to identify the 8 trigrams by symbol, element and pinyin name, and the 64 hexagrams by the same. Its super cool."
120,"I am conducting a series of lessons on Zhou Yi Dao meditation and the Yi Jing in Second Life. Those interested please contact me in private email.We have already had several lessons, and will be starting our Yi Jing studies in the coming weeks. We will be studying one pair of hexagrams each Sunday at 11 AM - 12 PM Eastern time."
121,"Subscriptions for My Ching, the I Ching Journal software for Windows, are now on sale at http://myching.softwareLast edited: Apr 9, 2016"
122,"If you are lucky enough to be near London, there is a group now meeting there, the London Yijing Society.Those of us far away can take advantage of their agendas being posted, and follow along from a distance. For this month's meeting on April 21, 2016, they are studying Hexagrams 8-16, and the first four chapters of the Great Treatise.Join in!Barbara"
123,"The existence of this site - http://adamsyi.com/ - is news to me, at least. And while I know less than nothing about physics, the way he writes about trigrams is very lucid and insightful. I can at least follow a couple of articles before I find myself out of my depth. I'm not really one to judge, but I think this is good stuff."
124,"Just a quick note to say*here is version 1.4*of the Resonance Journal.It*has a shiny new*random entry*option. You simply select ‘Review Random Entry’ from the ‘entries’ menu (or use the keyboard shortcut ctrl+m) to bring up a past entry. I’m finding this to be an intriguing opening for synchronicity:*useful reminders, different perspectives on hexagrams I’m living with now, invitations to benefit from hindsight. It makes ‘reviewing readings’*less like homework and more like a game – create the opening, see what shows up.Also, the software’s now faster and smoother – if you have a lot of entries, you’ll notice the difference when*running searches – and has some nice*little additions to its general user-friendliness,*like the way the entry tree automatically opens to the current entry when you switch there from list view.This is of course in addition to all the existing features…included translations with commentary (LiSe Heyboer’s and my own)quick ways to enter a Yijing reading – or cast one inside the journalincluded Language of Change Yijing glossarysuper-quick ‘cast history’ search (for the ‘didn’t I have that line/hexagram recently?’ moments)tags to track the*connections and resonances between readings, dreams and synchronicitiesadvanced search to find basically anything (now faster!)cross-linking entriesand so on…The 30 day trial is free to download. It won’t lock up your readings when the trial expires (because that would be tremendously annoying), but obviously we hope you’ll buy the full version to keep all the excellent search features…"
